<?xml version="1.0" encoding="utf-8"?>
<xs:schema attributeFormDefault="unqualified" elementFormDefault="qualified" xmlns:xs="http://www.w3.org/2001/XMLSchema">
  <xs:element name="cubescriptreference">
    <xs:complexType>
      <xs:sequence>
        <xs:element name="section">
          <xs:complexType>
            <xs:sequence>
              <xs:element maxOccurs="unbounded" name="command">
                <xs:complexType>
                  <xs:sequence>
                    <xs:element name="description" type="xs:string" />
                    <xs:element minOccurs="0" name="arguments">
                      <xs:complexType>
                        <xs:sequence>
                          <xs:element maxOccurs="unbounded" name="argument">
                            <xs:complexType>
                              <xs:attribute name="token" type="xs:string" use="required" />
                              <xs:attribute name="description" type="xs:string" use="required" />
                            </xs:complexType>
                          </xs:element>
                        </xs:sequence>
                      </xs:complexType>
                    </xs:element>
                  </xs:sequence>
                  <xs:attribute name="name" type="xs:string" use="required" />
                </xs:complexType>
              </xs:element>
            </xs:sequence>
            <xs:attribute name="name" type="xs:string" use="required" />
          </xs:complexType>
        </xs:element>
      </xs:sequence>
    </xs:complexType>
  </xs:element>
</xs:schema>